{
  "schema_version": 1,
  "diagram_type": "dataflow",
  "meta": {
    "title": "产品分析数据流",
    "output": "examples/dataflow-product-analytics.html",
    "viewBox": [
      1080,
      760
    ],
    "animation": "trace",
    "quality_profile": "showcase",
    "views": [
      {
        "id": "collection-path",
        "label": "采集路径",
        "focus": [
          "web",
          "mobile",
          "edge",
          "stream"
        ],
        "note": "跟随产品事件从客户端进入有序事件流。"
      },
      {
        "id": "consent-boundary",
        "label": "同意与隐私数据",
        "focus": [
          "edge",
          "consent",
          "pii"
        ],
        "note": "查看策略门和受限身份数据存储。"
      },
      {
        "id": "analytics-consumers",
        "label": "治理后的消费者",
        "focus": [
          "stream",
          "warehouse",
          "dashboard",
          "features",
          "model"
        ],
        "note": "查看整理后的事实、看板和衍生特征路径。"
      }
    ],
    "locale": "zh-CN"
  },
  "stages": [
    {
      "label": "Sources"
    },
    {
      "label": "Ingest"
    },
    {
      "label": "Process"
    },
    {
      "label": "Store"
    },
    {
      "label": "Consume"
    }
  ],
  "nodes": [
    {
      "id": "web",
      "type": "frontend",
      "label": "Web App",
      "sublabel": "网页应用",
      "stage": 0,
      "row": 0,
      "tag": "events"
    },
    {
      "id": "mobile",
      "type": "frontend",
      "label": "Mobile",
      "sublabel": "移动端",
      "stage": 0,
      "row": 2,
      "tag": "events"
    },
    {
      "id": "edge",
      "type": "cloud",
      "label": "Edge API",
      "sublabel": "边缘 API",
      "stage": 1,
      "row": 1,
      "tag": "TLS"
    },
    {
      "id": "consent",
      "type": "security",
      "label": "Consent Gate",
      "sublabel": "授权同意门",
      "stage": 2,
      "row": 0,
      "tag": "PII guard"
    },
    {
      "id": "stream",
      "type": "messagebus",
      "label": "Event Stream",
      "sublabel": "事件流",
      "stage": 2,
      "row": 2,
      "tag": "ordered"
    },
    {
      "id": "pii",
      "type": "security",
      "label": "PII Vault",
      "sublabel": "隐私数据保险库",
      "stage": 3,
      "row": 0,
      "tag": "restricted"
    },
    {
      "id": "warehouse",
      "type": "database",
      "label": "Warehouse",
      "sublabel": "数据仓库",
      "stage": 3,
      "row": 2,
      "tag": "curated"
    },
    {
      "id": "features",
      "type": "database",
      "label": "Feature Store",
      "sublabel": "特征库",
      "stage": 3,
      "row": 4,
      "tag": "derived"
    },
    {
      "id": "dashboard",
      "type": "backend",
      "label": "Dashboards",
      "sublabel": "数据看板",
      "stage": 4,
      "row": 1,
      "tag": "SQL"
    },
    {
      "id": "model",
      "type": "backend",
      "label": "ML Model",
      "sublabel": "机器学习模型",
      "stage": 4,
      "row": 4,
      "tag": "features"
    }
  ],
  "flows": [
    {
      "id": "web-clickstream",
      "from": "web",
      "to": "edge",
      "label": "clickstream",
      "classification": "user events",
      "variant": "emphasis",
      "fromSide": "right",
      "toSide": "left",
      "via": [
        [
          205,
          157
        ],
        [
          205,
          271
        ]
      ],
      "labelAt": [
        204,
        190
      ]
    },
    {
      "id": "mobile-events",
      "from": "mobile",
      "to": "edge",
      "label": "app events",
      "classification": "device events",
      "variant": "default",
      "fromSide": "right",
      "toSide": "left",
      "via": [
        [
          222,
          385
        ],
        [
          222,
          271
        ]
      ],
      "labelAt": [
        220,
        342
      ]
    },
    {
      "id": "consent-enrichment",
      "from": "edge",
      "to": "consent",
      "label": "identity + consent",
      "classification": "PII touch",
      "variant": "security",
      "fromSide": "top",
      "toSide": "left",
      "via": [
        [
          315,
          112
        ],
        [
          450,
          112
        ],
        [
          450,
          157
        ]
      ],
      "labelAt": [
        382,
        100
      ]
    },
    {
      "id": "accepted-events",
      "from": "edge",
      "to": "stream",
      "label": "accepted events",
      "classification": "append-only",
      "variant": "emphasis",
      "fromSide": "right",
      "toSide": "left",
      "via": [
        [
          420,
          271
        ],
        [
          420,
          385
        ]
      ],
      "labelAt": [
        438,
        324
      ]
    },
    {
      "id": "identity-map",
      "from": "consent",
      "to": "pii",
      "label": "identity map",
      "classification": "encrypted PII",
      "variant": "security",
      "route": "straight",
      "labelAt": [
        638,
        144
      ]
    },
    {
      "id": "normalized-facts",
      "from": "stream",
      "to": "warehouse",
      "label": "normalized facts",
      "classification": "non-PII",
      "variant": "emphasis",
      "route": "straight",
      "labelAt": [
        638,
        372
      ]
    },
    {
      "id": "daily-aggregates",
      "from": "warehouse",
      "to": "features",
      "label": "daily aggregates",
      "classification": "batch",
      "variant": "dashed",
      "fromSide": "bottom",
      "toSide": "top",
      "route": "straight",
      "labelAt": [
        745,
        496
      ]
    },
    {
      "id": "metrics-query",
      "from": "warehouse",
      "to": "dashboard",
      "label": "metrics SQL",
      "classification": "read-only",
      "variant": "default",
      "fromSide": "right",
      "toSide": "left",
      "via": [
        [
          852,
          385
        ],
        [
          852,
          271
        ]
      ],
      "labelAt": [
        830,
        326
      ]
    },
    {
      "id": "feature-vectors",
      "from": "features",
      "to": "model",
      "label": "feature vectors",
      "classification": "derived",
      "variant": "dashed",
      "route": "straight",
      "labelAt": [
        852,
        598
      ]
    },
    {
      "id": "restricted-join",
      "from": "pii",
      "to": "dashboard",
      "label": "restricted join",
      "classification": "approved only",
      "variant": "security",
      "fromSide": "right",
      "toSide": "top",
      "via": [
        [
          878,
          157
        ],
        [
          878,
          212
        ],
        [
          960,
          212
        ]
      ],
      "labelAt": [
        880,
        198
      ]
    }
  ],
  "cards": [
    {
      "dot": "emerald",
      "title": "主要数据路径",
      "items": [
        "事件从左到右经过来源、采集、处理、存储和消费阶段",
        "即使存在批处理支线，主链路仍保持清晰",
        "标签使用明确的数据资产名称，而不是泛化的 API 动词"
      ]
    },
    {
      "dot": "rose",
      "title": "敏感边界",
      "items": [
        "用户同意和 PII 路径按安全流处理",
        "PII 进入受限保险库，并与分析数仓隔离",
        "受限关联清晰可见，但不暗示默认拥有访问权限"
      ]
    },
    {
      "dot": "orange",
      "title": "衍生消费者",
      "items": [
        "数据看板从数仓读取整理后的事实",
        "特征向量由分析表批量生成",
        "消费路径与采集、授权处理保持区分"
      ]
    }
  ]
}
